resnet_18_meta_scheduler_sample_2/database_tuning_record.json
[0,[[[["GetBlock",[],["pad_temp","main"],["b0"]],["GetBlock",[],["conv2d_nchw","main"],["b1"]],["GetBlock",[],["root","main"],["b2"]],["Annotate",["b1","\"SSSRRSRS\""],["meta_schedule.tiling_structure"],[]],["GetLoops",["b1"],[],["l3","l4","l5","l6","l7","l8","l9"]],["SamplePerfectTile",["l3"],[5,64],["v10","v11","v12","v13","v14"]],["Split",["l3","v10","v11","v12","v13","v14"],[1],["l15","l16","l17","l18","l19"]],["SamplePerfectTile",["l4"],[5,64],["v20","v21","v22","v23","v24"]],["Split",["l4","v20","v21","v22","v23","v24"],[1],["l25","l26","l27","l28","l29"]],["SamplePerfectTile",["l5"],[5,64],["v30","v31","v32","v33","v34"]],["Split",["l5","v30","v31","v32","v33","v34"],[1],["l35","l36","l37","l38","l39"]],["SamplePerfectTile",["l6"],[5,64],["v40","v41","v42","v43","v44"]],["Split",["l6","v40","v41","v42","v43","v44"],[1],["l45","l46","l47","l48","l49"]],["SamplePerfectTile",["l7"],[3,64],["v50","v51","v52"]],["Split",["l7","v50","v51","v52"],[1],["l53","l54","l55"]],["SamplePerfectTile",["l8"],[3,64],["v56","v57","v58"]],["Split",["l8","v56","v57","v58"],[1],["l59","l60","l61"]],["SamplePerfectTile",["l9"],[3,64],["v62","v63","v64"]],["Split",["l9","v62","v63","v64"],[1],["l65","l66","l67"]],["Reorder",["l15","l25","l35","l45","l16","l26","l36","l46","l17","l27","l37","l47","l53","l59","l65","l54","l60","l66","l18","l28","l38","l48","l55","l61","l67","l19","l29","l39","l49"],[],[]],["Fuse",["l15","l25","l35","l45"],[1],["l68"]],["Bind",["l68"],["blockIdx.x"],[]],["Fuse",["l16","l26","l36","l46"],[1],["l69"]],["Bind",["l69"],["vthread.x"],[]],["Fuse",["l17","l27","l37","l47"],[1],["l70"]],["Bind",["l70"],["threadIdx.x"],[]],["Annotate",["b1",32],["meta_schedule.thread_extent_low_inclusive"],[]],["Annotate",["b1",1024],["meta_schedule.thread_extent_high_inclusive"],[]],["CacheWrite",["b1",[]],[0,"local"],["b71"]],["ReverseComputeAt",["b71","l70"],[1,-1],[]],["CacheRead",["b1",["b1"]],[0,"shared"],["b72"]],["ComputeAt",["b72","l65"],[1,-1],[]],["GetLoops",["b72"],[],["l73","l74","l75","l76","l77","l78","l79","l80","l81","l82"]],["Fuse",["l79","l80","l81","l82"],[1],["l83"]],["SampleCategorical",[],[[1,2,3,4],[0.25,0.25,0.25,0.25]],["v84"]],["Annotate",["b72","v84"],["meta_schedule.cooperative_fetch"],[]],["CacheRead",["b1",["b1"]],[1,"shared"],["b85"]],["ComputeAt",["b85","l65"],[1,-1],[]],["GetLoops",["b85"],[],["l86","l87","l88","l89","l90","l91","l92","l93","l94","l95"]],["Fuse",["l92","l93","l94","l95"],[1],["l96"]],["SampleCategorical",[],[[1,2,3,4],[0.25,0.25,0.25,0.25]],["v97"]],["Annotate",["b85","v97"],["meta_schedule.cooperative_fetch"],[]],["ComputeInline",["b0"],[],[]],["SampleCategorical",[],[[0,16,64,512,1024],[0.2000000000000000111,0.2000000000000000111,0.2000000000000000111,0.2000000000000000111,0.2000000000000000111]],["v98"]],["Annotate",["b2","v98"],["meta_schedule.unroll_explicit"],[]],["EnterPostproc",[],[],[]],["Unannotate",["b72"],["meta_schedule.cooperative_fetch"],[]],["GetLoops",["b72"],[],["l99","l100","l101","l102","l103","l104","l105"]],["Split",["l105","None",64],[1],["l106","l107"]],["Bind",["l107"],["threadIdx.x"],[]],["Unannotate",["b85"],["meta_schedule.cooperative_fetch"],[]],["GetLoops",["b85"],[],["l108","l109","l110","l111","l112","l113","l114"]],["Split",["l114","None",64,2],[1],["l115","l116","l117"]],["Vectorize",["l117"],[],[]],["Bind",["l116"],["threadIdx.x"],[]],["GetBlock",[],["root","main"],["b118"]],["Unannotate",["b118"],["meta_schedule.unroll_explicit"],[]],["GetChildBlocks",["b118"],[],["b119","b120","b121","b122"]],["GetLoops",["b119"],[],["l123","l124","l125","l126","l127","l128","l129","l130"]],["GetLoops",["b120"],[],["l131","l132","l133","l134","l135","l136","l137","l138","l139"]],["GetLoops",["b121"],[],["l140","l141","l142","l143","l144","l145","l146","l147","l148","l149","l150","l151","l152","l153","l154","l155","l156","l157","l158","l159"]],["Annotate",["l140",1024],["pragma_auto_unroll_max_step"],[]],["Annotate",["l140",1],["pragma_unroll_explicit"],[]],["GetLoops",["b122"],[],["l160","l161","l162","l163","l164","l165","l166"]],["GetBlock",[],["conv2d_nchw","main"],["b167"]],["GetLoops",["b167"],[],["l168","l169","l170","l171","l172","l173","l174","l175","l176","l177","l178","l179","l180","l181","l182","l183","l184","l185","l186","l187"]],["DecomposeReduction",["b167","l171"],[],["b188"]]],[[5,[1,1,1,1,1]],[7,[4,2,64,1,1]],[9,[1,7,1,1,1]],[11,[7,1,1,1,1]],[13,[8,8,4]],[15,[1,1,1]],[17,[1,1,1]],[34,2],[40,1],[43,4]]],[2.10478911166805885e-05],{"arch":"sm_80","keys":["cuda","gpu"],"kind":"cuda","l2_cache_size_bytes":41943040,"max_num_threads":1024,"max_shared_memory_per_block":49152,"max_threads_per_block":1024,"registers_per_block":65536,"tag":"","thread_warp_size":32},[["TENSOR","float32",[1,256,14,14]],["TENSOR","float32",[512,256,1,1]],["TENSOR","float32",[1,512,7,7]]]]]
[0,[[[["GetBlock",[],["pad_temp","main"],["b0"]],["GetBlock",[],["conv2d_nchw","main"],["b1"]],["GetBlock",[],["root","main"],["b2"]],["Annotate",["b1","\"SSSRRSRS\""],["meta_schedule.tiling_structure"],[]],["GetLoops",["b1"],[],["l3","l4","l5","l6","l7","l8","l9"]],["SamplePerfectTile",["l3"],[5,64],["v10","v11","v12","v13","v14"]],["Split",["l3","v10","v11","v12","v13","v14"],[1],["l15","l16","l17","l18","l19"]],["SamplePerfectTile",["l4"],[5,64],["v20","v21","v22","v23","v24"]],["Split",["l4","v20","v21","v22","v23","v24"],[1],["l25","l26","l27","l28","l29"]],["SamplePerfectTile",["l5"],[5,64],["v30","v31","v32","v33","v34"]],["Split",["l5","v30","v31","v32","v33","v34"],[1],["l35","l36","l37","l38","l39"]],["SamplePerfectTile",["l6"],[5,64],["v40","v41","v42","v43","v44"]],["Split",["l6","v40","v41","v42","v43","v44"],[1],["l45","l46","l47","l48","l49"]],["SamplePerfectTile",["l7"],[3,64],["v50","v51","v52"]],["Split",["l7","v50","v51","v52"],[1],["l53","l54","l55"]],["SamplePerfectTile",["l8"],[3,64],["v56","v57","v58"]],["Split",["l8","v56","v57","v58"],[1],["l59","l60","l61"]],["SamplePerfectTile",["l9"],[3,64],["v62","v63","v64"]],["Split",["l9","v62","v63","v64"],[1],["l65","l66","l67"]],["Reorder",["l15","l25","l35","l45","l16","l26","l36","l46","l17","l27","l37","l47","l53","l59","l65","l54","l60","l66","l18","l28","l38","l48","l55","l61","l67","l19","l29","l39","l49"],[],[]],["Fuse",["l15","l25","l35","l45"],[1],["l68"]],["Bind",["l68"],["blockIdx.x"],[]],["Fuse",["l16","l26","l36","l46"],[1],["l69"]],["Bind",["l69"],["vthread.x"],[]],["Fuse",["l17","l27","l37","l47"],[1],["l70"]],["Bind",["l70"],["threadIdx.x"],[]],["Annotate",["b1",32],["meta_schedule.thread_extent_low_inclusive"],[]],["Annotate",["b1",1024],["meta_schedule.thread_extent_high_inclusive"],[]],["CacheWrite",["b1",[]],[0,"local"],["b71"]],["ReverseComputeAt",["b71","l70"],[1,-1],[]],["CacheRead",["b1",["b1"]],[0,"shared"],["b72"]],["ComputeAt",["b72","l65"],[1,-1],[]],["GetLoops",["b72"],[],["l73","l74","l75","l76","l77","l78","l79","l80","l81","l82"]],["Fuse",["l79","l80","l81","l82"],[1],["l83"]],["SampleCategorical",[],[[1,2,3,4],[0.25,0.25,0.25,0.25]],["v84"]],["Annotate",["b72","v84"],["meta_schedule.cooperative_fetch"],[]],["CacheRead",["b1",["b1"]],[1,"shared"],["b85"]],["ComputeAt",["b85","l65"],[1,-1],[]],["GetLoops",["b85"],[],["l86","l87","l88","l89","l90","l91","l92","l93","l94","l95"]],["Fuse",["l92","l93","l94","l95"],[1],["l96"]],["SampleCategorical",[],[[1,2,3,4],[0.25,0.25,0.25,0.25]],["v97"]],["Annotate",["b85","v97"],["meta_schedule.cooperative_fetch"],[]],["Fuse",["l53","l59","l65"],[1],["l98"]],["Annotate",["l98",[0,0,2]],["software_pipeline_stage"],[]],["Annotate",["l98",[0,1,2]],["software_pipeline_order"],[]],["Annotate",["l98",[0]],["software_pipeline_async_stages"],[]],["ComputeInline",["b0"],[],[]],["SampleCategorical",[],[[0,16,64,512,1024],[0.2000000000000000111,0.2000000000000000111,0.2000000000000000111,0.2000000000000000111,0.2000000000000000111]],["v99"]],["Annotate",["b2","v99"],["meta_schedule.unroll_explicit"],[]],["EnterPostproc",[],[],[]],["Unannotate",["b72"],["meta_schedule.cooperative_fetch"],[]],["GetLoops",["b72"],[],["l100","l101","l102","l103","l104"]],["Split",["l104","None",64],[1],["l105","l106"]],["Bind",["l106"],["threadIdx.x"],[]],["Unannotate",["b85"],["meta_schedule.cooperative_fetch"],[]],["GetLoops",["b85"],[],["l107","l108","l109","l110","l111"]],["Split",["l111","None",64],[1],["l112","l113"]],["Bind",["l113"],["threadIdx.x"],[]],["GetBlock",[],["root","main"],["b114"]],["Unannotate",["b114"],["meta_schedule.unroll_explicit"],[]],["GetChildBlocks",["b114"],[],["b115","b116","b117","b118"]],["GetLoops",["b115"],[],["l119","l120","l121","l122","l123","l124"]],["GetLoops",["b116"],[],["l125","l126","l127","l128","l129","l130"]],["GetLoops",["b117"],[],["l131","l132","l133","l134","l135","l136","l137","l138","l139","l140","l141","l142","l143","l144","l145","l146","l147","l148"]],["Annotate",["l131",512],["pragma_auto_unroll_max_step"],[]],["Annotate",["l131",1],["pragma_unroll_explicit"],[]],["GetLoops",["b118"],[],["l149","l150","l151","l152","l153","l154","l155"]],["GetBlock",[],["conv2d_nchw","main"],["b156"]],["GetLoops",["b156"],[],["l157","l158","l159","l160","l161","l162","l163","l164","l165","l166","l167","l168","l169","l170","l171","l172","l173","l174"]],["DecomposeReduction",["b156","l160"],[],["b175"]]],[[5,[1,1,1,1,1]],[7,[1,2,64,1,4]],[9,[1,1,1,1,7]],[11,[1,1,1,7,1]],[13,[64,1,4]],[15,[1,1,1]],[17,[1,1,1]],[34,0],[40,0],[47,3]]],[0.00051145062857142862146],{"arch":"sm_80","keys":["cuda","gpu"],"kind":"cuda","l2_cache_size_bytes":41943040,"max_num_threads":1024,"max_shared_memory_per_block":49152,"max_threads_per_block":1024,"registers_per_block":65536,"tag":"","thread_warp_size":32},[["TENSOR","float32",[1,256,14,14]],["TENSOR","float32",[512,256,1,1]],["TENSOR","float32",[1,512,7,7]]]]]
[1,[[[["GetBlock",[],["pad_temp","main"],["b0"]],["GetBlock",[],["conv2d_nchw","main"],["b1"]],["GetBlock",[],["root","main"],["b2"]],["Annotate",["b1","\"SSSRRSRS\""],["meta_schedule.tiling_structure"],[]],["GetLoops",["b1"],[],["l3","l4","l5","l6","l7","l8","l9"]],["SamplePerfectTile",["l3"],[5,64],["v10","v11","v12","v13","v14"]],["Split",["l3","v10","v11","v12","v13","v14"],[1],["l15","l16","l17","l18","l19"]],["SamplePerfectTile",["l4"],[5,64],["v20","v21","v22","v23","v24"]],["Split",["l4","v20","v21","v22","v23","v24"],[1],["l25","l26","l27","l28","l29"]],["SamplePerfectTile",["l5"],[5,64],["v30","v31","v32","v33","v34"]],["Split",["l5","v30","v31","v32","v33","v34"],[1],["l35","l36","l37","l38","l39"]],["SamplePerfectTile",["l6"],[5,64],["v40","v41","v42","v43","v44"]],["Split",["l6","v40","v41","v42","v43","v44"],[1],["l45","l46","l47","l48","l49"]],["SamplePerfectTile",["l7"],[3,64],["v50","v51","v52"]],["Split",["l7","v50","v51","v52"],[1],["l53","l54","l55"]],["SamplePerfectTile",["l8"],[3,64],["v56","v57","v58"]],["Split",["l8","v56","v57","v58"],[1],["l59","l60","l61"]],["SamplePerfectTile",["l9"],[3,64],["v62","v63","v64"]],["Split",["l9","v62","v63","v64"],[1],["l65","l66","l67"]],["Reorder",["l15","l25","l35","l45","l16","l26","l36","l46","l17","l27","l37","l47","l53","l59","l65","l54","l60","l66","l18","l28","l38","l48","l55","l61","l67","l19","l29","l39","l49"],[],[]],["Fuse",["l15","l25","l35","l45"],[1],["l68"]],["Bind",["l68"],["blockIdx.x"],[]],["Fuse",["l16","l26","l36","l46"],[1],["l69"]],["Bind",["l69"],["vthread.x"],[]],["Fuse",["l17","l27","l37","l47"],[1],["l70"]],["Bind",["l70"],["threadIdx.x"],[]],["Annotate",["b1",32],["meta_schedule.thread_extent_low_inclusive"],[]],["Annotate",["b1",1024],["meta_schedule.thread_extent_high_inclusive"],[]],["CacheWrite",["b1",[]],[0,"local"],["b71"]],["ReverseComputeAt",["b71","l70"],[1,-1],[]],["CacheRead",["b1",["b1"]],[0,"shared"],["b72"]],["ComputeAt",["b72","l65"],[1,-1],[]],["GetLoops",["b72"],[],["l73","l74","l75","l76","l77","l78","l79","l80","l81","l82"]],["Fuse",["l79","l80","l81","l82"],[1],["l83"]],["SampleCategorical",[],[[1,2,3,4],[0.25,0.25,0.25,0.25]],["v84"]],["Annotate",["b72","v84"],["meta_schedule.cooperative_fetch"],[]],["CacheRead",["b1",["b1"]],[1,"shared"],["b85"]],["ComputeAt",["b85","l65"],[1,-1],[]],["GetLoops",["b85"],[],["l86","l87","l88","l89","l90","l91","l92","l93","l94","l95"]],["Fuse",["l92","l93","l94","l95"],[1],["l96"]],["SampleCategorical",[],[[1,2,3,4],[0.25,0.25,0.25,0.25]],["v97"]],["Annotate",["b85","v97"],["meta_schedule.cooperative_fetch"],[]],["Fuse",["l53","l59","l65"],[1],["l98"]],["Annotate",["l98",[0,0,3]],["software_pipeline_stage"],[]],["Annotate",["l98",[0,1,2]],["software_pipeline_order"],[]],["Annotate",["l98",[0]],["software_pipeline_async_stages"],[]],["ComputeInline",["b0"],[],[]],["SampleCategorical",[],[[0,16,64,512,1024],[0.2000000000000000111,0.2000000000000000111,0.2000000000000000111,0.2000000000000000111,0.2000000000000000111]],["v99"]],["Annotate",["b2","v99"],["meta_schedule.unroll_explicit"],[]],["EnterPostproc",[],[],[]],["Unannotate",["b72"],["meta_schedule.cooperative_fetch"],[]],["GetLoops",["b72"],[],["l100","l101","l102","l103","l104"]],["Split",["l104","None",32,4],[1],["l105","l106","l107"]],["Vectorize",["l107"],[],[]],["Bind",["l106"],["threadIdx.x"],[]],["Unannotate",["b85"],["meta_schedule.cooperative_fetch"],[]],["GetLoops",["b85"],[],["l108","l109","l110","l111","l112"]],["Split",["l112","None",32],[1],["l113","l114"]],["Bind",["l114"],["threadIdx.x"],[]],["GetBlock",[],["root","main"],["b115"]],["Unannotate",["b115"],["meta_schedule.unroll_explicit"],[]],["GetChildBlocks",["b115"],[],["b116","b117","b118","b119"]],["GetLoops",["b116"],[],["l120","l121","l122","l123","l124","l125","l126"]],["GetLoops",["b117"],[],["l127","l128","l129","l130","l131","l132"]],["GetLoops",["b118"],[],["l133","l134","l135","l136","l137","l138","l139","l140","l141","l142","l143","l144","l145","l146","l147","l148","l149","l150"]],["Annotate",["l133",1024],["pragma_auto_unroll_max_step"],[]],["Annotate",["l133",1],["pragma_unroll_explicit"],[]],["GetLoops",["b119"],[],["l151","l152","l153","l154","l155","l156","l157"]],["GetBlock",[],["conv2d_nchw","main"],["b158"]],["GetLoops",["b158"],[],["l159","l160","l161","l162","l163","l164","l165","l166","l167","l168","l169","l170","l171","l172","l173","l174","l175","l176"]],["DecomposeReduction",["b158","l162"],[],["b177"]]],[[5,[1,1,1,1,1]],[7,[2,2,16,1,4]],[9,[7,2,1,1,1]],[11,[1,7,2,1,1]],[13,[16,8,1]],[15,[1,1,1]],[17,[1,1,1]],[34,3],[40,0],[47,4]]],[4.104653574275843775e-05],{"arch":"sm_80","keys":["cuda","gpu"],"kind":"cuda","l2_cache_size_bytes":41943040,"max_num_threads":1024,"max_shared_memory_per_block":49152,"max_threads_per_block":1024,"registers_per_block":65536,"tag":"","thread_warp_size":32},[["TENSOR","float32",[1,128,28,28]],["TENSOR","float32",[256,128,1,1]],["TENSOR","float32",[1,256,14,14]]]]]
[1,[[[["GetBlock",[],["pad_temp","main"],["b0"]],["GetBlock",[],["conv2d_nchw","main"],["b1"]],["GetBlock",[],["root","main"],["b2"]],["Annotate",["b1","\"SSSRRSRS\""],["meta_schedule.tiling_structure"],[]],["GetLoops",["b1"],[],["l3","l4","l5","l6","l7","l8","l9"]],["SamplePerfectTile",["l3"],[5,64],["v10","v11","v12","v13","v14"]],["Split",["l3","v10","v11","v12","v13","v14"],[1],["l15","l16","l17","l18","l19"]],["SamplePerfectTile",["l4"],[5,64],["v20","v21","v22","v23","v24"]],["Split",["l4","v20","v21","v22","v23","v24"],[1],["l25","l26","l27","l28","l29"]],["SamplePerfectTile",["l5"],[5,64],["v30","v31","v32","v33","v34"]],["Split",["l5","v30","v31","v32","v33","v34"],[1],["l35","l36","l37","l38","l39"]],["SamplePerfectTile",["l6"],[5,64],["v40","v41","v42","v43","v44"]],["Split",["l6","v40","v41","v42","v43","v44"],[1],["l45","l46","l47","l48","l49"]],["SamplePerfectTile",["l7"],[3,64],["v50","v51","v52"]],["Split",["l7","v50","v51","v52"],[1],["l53","l54","l55"]],["SamplePerfectTile",["l8"],[3,64],["v56","v57","v58"]],["Split",["l8","v56","v57","v58"],[1],["l59","l60","l61"]],["SamplePerfectTile",["l9"],[3,64],["v62","v63","v64"]],["Split",["l9","v62","v63","v64"],[1],["l65","l66","l67"]],["Reorder",["l15","l25","l35","l45","l16","l26","l36","l46","l17","l27","l37","l47","l53","l59","l65","l54","l60","l66","l18","l28","l38","l48","l55","l61","l67","l19","l29","l39","l49"],[],[]],["Fuse",["l15","l25","l35","l45"],[1],["l68"]],["Bind",["l68"],["blockIdx.x"],[]],["Fuse",["l16","l26","l36","l46"],[1],["l69"]],["Bind",["l69"],["vthread.x"],[]],["Fuse",["l17","l27","l37","l47"],[1],["l70"]],["Bind",["l70"],["threadIdx.x"],[]],["Annotate",["b1",32],["meta_schedule.thread_extent_low_inclusive"],[]],["Annotate",["b1",1024],["meta_schedule.thread_extent_high_inclusive"],[]],["CacheWrite",["b1",[]],[0,"local"],["b71"]],["ReverseComputeAt",["b71","l70"],[1,-1],[]],["CacheRead",["b1",["b1"]],[0,"shared"],["b72"]],["ComputeAt",["b72","l65"],[1,-1],[]],["GetLoops",["b72"],[],["l73","l74","l75","l76","l77","l78","l79","l80","l81","l82"]],["Fuse",["l79","l80","l81","l82"],[1],["l83"]],["SampleCategorical",[],[[1,2,3,4],[0.25,0.25,0.25,0.25]],["v84"]],["Annotate",["b72","v84"],["meta_schedule.cooperative_fetch"],[]],["CacheRead",["b1",["b1"]],[1,"shared"],["b85"]],["ComputeAt",["b85","l65"],[1,-1],[]],["GetLoops",["b85"],[],["l86","l87","l88","l89","l90","l91","l92","l93","l94","l95"]],["Fuse",["l92","l93","l94","l95"],[1],["l96"]],["SampleCategorical",[],[[1,2,3,4],[0.25,0.25,0.25,0.25]],["v97"]],["Annotate",["b85","v97"],["meta_schedule.cooperative_fetch"],[]],["ComputeInline",["b0"],[],[]],["SampleCategorical",[],[[0,16,64,512,1024],[0.2000000000000000111,0.2000000000000000111,0.2000000000000000111,0.2000000000000000111,0.2000000000000000111]],["v98"]],["Annotate",["b2","v98"],["meta_schedule.unroll_explicit"],[]],["EnterPostproc",[],[],[]],["Unannotate",["b72"],["meta_schedule.cooperative_fetch"],[]],["GetLoops",["b72"],[],["l99","l100","l101","l102","l103","l104","l105"]],["Split",["l105","None",448],[1],["l106","l107"]],["Bind",["l107"],["threadIdx.x"],[]],["Unannotate",["b85"],["meta_schedule.cooperative_fetch"],[]],["GetLoops",["b85"],[],["l108","l109","l110","l111","l112","l113","l114"]],["Split",["l114","None",448,4],[1],["l115","l116","l117"]],["Vectorize",["l117"],[],[]],["Bind",["l116"],["threadIdx.x"],[]],["GetBlock",[],["root","main"],["b118"]],["Unannotate",["b118"],["meta_schedule.unroll_explicit"],[]],["GetChildBlocks",["b118"],[],["b119","b120","b121","b122"]],["GetLoops",["b119"],[],["l123","l124","l125","l126","l127","l128","l129","l130"]],["GetLoops",["b120"],[],["l131","l132","l133","l134","l135","l136","l137","l138","l139"]],["GetLoops",["b121"],[],["l140","l141","l142","l143","l144","l145","l146","l147","l148","l149","l150","l151","l152","l153","l154","l155","l156","l157","l158","l159"]],["Annotate",["l140",512],["pragma_auto_unroll_max_step"],[]],["Annotate",["l140",1],["pragma_unroll_explicit"],[]],["GetLoops",["b122"],[],["l160","l161","l162","l163","l164","l165","l166"]],["GetBlock",[],["conv2d_nchw","main"],["b167"]],["GetLoops",["b167"],[],["l168","l169","l170","l171","l172","l173","l174","l175","l176","l177","l178","l179","l180","l181","l182","l183","l184","l185","l186","l187"]],["DecomposeReduction",["b167","l171"],[],["b188"]]],[[5,[1,1,1,1,1]],[7,[1,1,64,1,4]],[9,[1,1,7,2,1]],[11,[1,1,1,2,7]],[13,[32,4,1]],[15,[1,1,1]],[17,[1,1,1]],[34,0],[40,3],[43,3]]],[0.00021672326747311827116],{"arch":"sm_80","keys":["cuda","gpu"],"kind":"cuda","l2_cache_size_bytes":41943040,"max_num_threads":1024,"max_shared_memory_per_block":49152,"max_threads_per_block":1024,"registers_per_block":65536,"tag":"","thread_warp_size":32},[["TENSOR","float32",[1,128,28,28]],["TENSOR","float32",[256,128,1,1]],["TENSOR","float32",[1,256,14,14]]]]]
[2,[[[["GetBlock",[],["pad_temp","main"],["b0"]],["GetBlock",[],["conv2d_nchw","main"],["b1"]],["GetBlock",[],["root","main"],["b2"]],["Annotate",["b1","\"SSSRRSRS\""],["meta_schedule.tiling_structure"],[]],["GetLoops",["b1"],[],["l3","l4","l5","l6","l7","l8","l9"]],["SamplePerfectTile",["l3"],[5,64],["v10","v11","v12","v13","v14"]],["Split",["l3","v10","v11","v12","v13","v14"],[1],["l15","l16","l17","l18","l19"]],["SamplePerfectTile",["l4"],[5,64],["v20","v21","v22","v23","v24"]],["Split",["l4","v20","v21","v22","v23","v24"],[1],["l25","l26","l27","l28","l29"]],["SamplePerfectTile",["l5"],[5,64],["v30","v31","v32","v33","v34"]],["Split",["l5","v30","v31","v32","v33","v34"],[1],["l35","l36","l37","l38","l39"]],["SamplePerfectTile",["l6"],[5,64],["v40","v41","v42","v43","v44"]],["Split",["l6","v40","v41","v42","v43","v44"],[1],["l45","l46","l47","l48","l49"]],["SamplePerfectTile",["l7"],[3,64],["v50","v51","v52"]],["Split",["l7","v50","v51","v52"],[1],["l53","l54","l55"]],["SamplePerfectTile",["l8"],[3,64],["v56","v57","v58"]],["Split",["l8","v56","v57","v58"],[1],["l59","l60","l61"]],["SamplePerfectTile",["l9"],[3,64],["v62","v63","v64"]],["Split",["l9","v62","v63","v64"],[1],["l65","l66","l67"]],["Reorder",["l15","l25","l35","l45","l16","l26","l36","l46","l17","l27","l37","l47","l53","l59","l65","l54","l60","l66","l18","l28","l38","l48","l55","l61","l67","l19","l29","l39","l49"],[],[]],["Fuse",["l15","l25","l35","l45"],[1],["l68"]],["Bind",["l68"],["blockIdx.x"],[]],["Fuse",["l16","l26","l36","l46"],[1],["l69"]],["Bind",["l69"],["vthread.x"],[]],["Fuse",["l17","l27","l37","l47"],[1],["l70"]],["Bind",["l70"],["threadIdx.x"],[]],["Annotate",["b1",32],["meta_schedule.thread_extent_low_inclusive"],[]],["Annotate",["b1",1024],["meta_schedule.thread_extent_high_inclusive"],[]],["CacheWrite",["b1",[]],[0,"local"],["b71"]],["ReverseComputeAt",["b71","l70"],[1,-1],[]],["CacheRead",["b1",["b1"]],[0,"shared"],["b72"]],["ComputeAt",["b72","l65"],[1,-1],[]],["GetLoops",["b72"],[],["l73","l74","l75","l76","l77","l78","l79","l80","l81","l82"]],["Fuse",["l79","l80","l81","l82"],[1],["l83"]],["SampleCategorical",[],[[1,2,3,4],[0.25,0.25,0.25,0.25]],["v84"]],["Annotate",["b72","v84"],["meta_schedule.cooperative_fetch"],[]],["CacheRead",["b1",["b1"]],[1,"shared"],["b85"]],["ComputeAt",["b85","l65"],[1,-1],[]],["GetLoops",["b85"],[],["l86","l87","l88","l89","l90","l91","l92","l93","l94","l95"]],["Fuse",["l92","l93","l94","l95"],[1],["l96"]],["SampleCategorical",[],[[1,2,3,4],[0.25,0.25,0.25,0.25]],["v97"]],["Annotate",["b85","v97"],["meta_schedule.cooperative_fetch"],[]],["Fuse",["l53","l59","l65"],[1],["l98"]],["Annotate",["l98",[0,0,3]],["software_pipeline_stage"],[]],["Annotate",["l98",[0,1,2]],["software_pipeline_order"],[]],["Annotate",["l98",[0]],["software_pipeline_async_stages"],[]],["ComputeInline",["b0"],[],[]],["SampleCategorical",[],[[0,16,64,512,1024],[0.2000000000000000111,0.2000000000000000111,0.2000000000000000111,0.2000000000000000111,0.2000000000000000111]],["v99"]],["Annotate",["b2","v99"],["meta_schedule.unroll_explicit"],[]],["EnterPostproc",[],[],[]],["Unannotate",["b72"],["meta_schedule.cooperative_fetch"],[]],["GetLoops",["b72"],[],["l100","l101","l102","l103","l104"]],["Split",["l104","None",56,3],[1],["l105","l106","l107"]],["Vectorize",["l107"],[],[]],["Bind",["l106"],["threadIdx.x"],[]],["Unannotate",["b85"],["meta_schedule.cooperative_fetch"],[]],["GetLoops",["b85"],[],["l108","l109","l110","l111","l112"]],["Split",["l112","None",56],[1],["l113","l114"]],["Bind",["l114"],["threadIdx.x"],[]],["GetBlock",[],["root","main"],["b115"]],["Unannotate",["b115"],["meta_schedule.unroll_explicit"],[]],["GetChildBlocks",["b115"],[],["b116","b117","b118","b119"]],["GetLoops",["b116"],[],["l120","l121","l122","l123","l124","l125","l126"]],["GetLoops",["b117"],[],["l127","l128","l129","l130","l131","l132"]],["GetLoops",["b118"],[],["l133","l134","l135","l136","l137","l138","l139","l140","l141","l142","l143","l144","l145","l146","l147","l148","l149","l150"]],["Annotate",["l133",512],["pragma_auto_unroll_max_step"],[]],["Annotate",["l133",1],["pragma_unroll_explicit"],[]],["GetLoops",["b119"],[],["l151","l152","l153","l154","l155","l156","l157"]],["GetBlock",[],["conv2d_nchw","main"],["b158"]],["GetLoops",["b158"],[],["l159","l160","l161","l162","l163","l164","l165","l166","l167","l168","l169","l170","l171","l172","l173","l174","l175","l176"]],["DecomposeReduction",["b158","l162"],[],["b177"]]],[[5,[1,1,1,1,1]],[7,[8,2,8,1,1]],[9,[2,1,1,1,14]],[11,[1,1,7,2,2]],[13,[32,1,2]],[15,[1,1,1]],[17,[1,1,1]],[34,2],[40,0],[47,3]]],[4.1774109910883065017e-05],{"arch":"sm_80","keys":["cuda","gpu"],"kind":"cuda","l2_cache_size_bytes":41943040,"max_num_threads":1024,"max_shared_memory_per_block":49152,"max_threads_per_block":1024,"registers_per_block":65536,"tag":"","thread_warp_size":32},[["TENSOR","float32",[1,64,56,56]],["TENSOR","float32",[128,64,1,1]],["TENSOR","float32",[1,128,28,28]]]]]
[5,[[[["GetBlock",[],["pad_temp","main"],["b0"]],["GetBlock",[],["conv2d_nchw","main"],["b1"]],["GetBlock",[],["T_add","main"],["b2"]],["GetBlock",[],["T_relu","main"],["b3"]],["GetBlock",[],["root","main"],["b4"]],["Annotate",["b1","\"SSSRRSRS\""],["meta_schedule.tiling_structure"],[]],["GetLoops",["b1"],[],["l5","l6","l7","l8","l9","l10","l11"]],["SamplePerfectTile",["l5"],[5,64],["v12","v13","v14","v15","v16"]],["Split",["l5","v12","v13","v14","v15","v16"],[1],["l17","l18","l19","l20","l21"]],["SamplePerfectTile",["l6"],[5,64],["v22","v23","v24","v25","v26"]],["Split",["l6","v22","v23","v24","v25","v26"],[1],["l27","l28","l29","l30","l31"]],["SamplePerfectTile",["l7"],[5,64],["v32","v33","v34","v35","v36"]],["Split",["l7","v32","v33","v34","v35","v36"],[1],["l37","l38","l39","l40","l41"]],["SamplePerfectTile",["l8"],[5,64],["v42","v43","v44","v45","v46"]],["Split",["l8","v42","v43","v44","v45","v46"],[1],["l47","l48","l49","l50","l51"]],["SamplePerfectTile",["l9"],[3,64],["v52","v53","v54"]],["Split",["l9","v52","v53","v54"],[1],["l55","l56","l57"]],["SamplePerfectTile",["l10"],[3,64],["v58","v59","v60"]],["Split",["l10","v58","v59","v60"],[1],["l61","l62","l63"]],["SamplePerfectTile",["l11"],[3,64],["v64","v65","v66"]],["Split",["l11","v64","v65","v66"],[1],["l67","l68","l69"]],["Reorder",["l17","l27","l37","l47","l18","l28","l38","l48","l19","l29","l39","l49","l55","l61","l67","l56","l62","l68","l20","l30","l40","l50","l57","l63","l69","l21","l31","l41","l51"],[],[]],["Fuse",["l17","l27","l37","l47"],[1],["l70"]],["Bind",["l70"],["blockIdx.x"],[]],["Fuse",["l18","l28","l38","l48"],[1],["l71"]],["Bind",["l71"],["vthread.x"],[]],["Fuse",["l19","l29","l39","l49"],[1],["l72"]],["Bind",["l72"],["threadIdx.x"],[]],["Annotate",["b1",32],["meta_schedule.thread_extent_low_inclusive"],[]],["Annotate",["b1",1024],["meta_schedule.thread_extent_high_inclusive"],[]],["CacheWrite",["b1",[]],[0,"local"],["b73"]],["ReverseComputeAt",["b73","l72"],[1,-1],[]],["CacheRead",["b1",["b1"]],[0,"shared"],["b74"]],["ComputeAt",["b74","l67"],[1,-1],[]],["GetLoops",["b74"],[],["l75","l76","l77","l78","l79","l80","l81","l82","l83","l84"]],["Fuse",["l81","l82","l83","l84"],[1],["l85"]],["SampleCategorical",[],[[1,2,3,4],[0.25,0.25,0.25,0.25]],["v86"]],["Annotate",["b74","v86"],["meta_schedule.cooperative_fetch"],[]],["CacheRead",["b1",["b1"]],[1,"shared"],["b87"]],["ComputeAt",["b87","l67"],[1,-1],[]],["GetLoops",["b87"],[],["l88","l89","l90","l91","l92","l93","l94","l95","l96","l97"]],["Fuse",["l94","l95","l96","l97"],[1],["l98"]],["SampleCategorical",[],[[1,2,3,4],[0.25,0.25,0.25,0.25]],["v99"]],["Annotate",["b87","v99"],["meta_schedule.cooperative_fetch"],[]],["ReverseComputeInline",["b3"],[],[]],["ReverseComputeInline",["b2"],[],[]],["ComputeInline",["b0"],[],[]],["SampleCategorical",[],[[0,16,64,512,1024],[0.2000000000000000111,0.2000000000000000111,0.2000000000000000111,0.2000000000000000111,0.2000000000000000111]],["v100"]],["Annotate",["b4","v100"],["meta_schedule.unroll_explicit"],[]],["EnterPostproc",[],[],[]],["Unannotate",["b74"],["meta_schedule.cooperative_fetch"],[]],["GetLoops",["b74"],[],["l101","l102","l103","l104","l105","l106","l107"]],["Split",["l107","None",224],[1],["l108","l109"]],["Bind",["l109"],["threadIdx.x"],[]],["Unannotate",["b87"],["meta_schedule.cooperative_fetch"],[]],["GetLoops",["b87"],[],["l110","l111","l112","l113","l114","l115","l116"]],["Split",["l116","None",224],[1],["l117","l118"]],["Bind",["l118"],["threadIdx.x"],[]],["GetBlock",[],["root","main"],["b119"]],["Unannotate",["b119"],["meta_schedule.unroll_explicit"],[]],["GetChildBlocks",["b119"],[],["b120","b121","b122","b123"]],["GetLoops",["b120"],[],["l124","l125","l126","l127","l128","l129","l130","l131"]],["GetLoops",["b121"],[],["l132","l133","l134","l135","l136","l137","l138","l139"]],["GetLoops",["b122"],[],["l140","l141","l142","l143","l144","l145","l146","l147","l148","l149","l150","l151","l152","l153","l154","l155","l156","l157","l158","l159"]],["Annotate",["l140",64],["pragma_auto_unroll_max_step"],[]],["Annotate",["l140",1],["pragma_unroll_explicit"],[]],["GetLoops",["b123"],[],["l160","l161","l162","l163","l164","l165","l166"]],["GetBlock",[],["conv2d_nchw","main"],["b167"]],["GetLoops",["b167"],[],["l168","l169","l170","l171","l172","l173","l174","l175","l176","l177","l178","l179","l180","l181","l182","l183","l184","l185","l186","l187"]],["DecomposeReduction",["b167","l171"],[],["b188"]]],[[7,[1,1,1,1,1]],[9,[2,1,4,1,8]],[11,[1,2,28,2,1]],[13,[14,2,2,2,1]],[15,[3,1,1]],[17,[7,1,1]],[19,[7,1,1]],[36,1],[42,0],[47,2]]],[0.00025655200637958534273],{"arch":"sm_80","keys":["cuda","gpu"],"kind":"cuda","l2_cache_size_bytes":41943040,"max_num_threads":1024,"max_shared_memory_per_block":49152,"max_threads_per_block":1024,"registers_per_block":65536,"tag":"","thread_warp_size":32},[["TENSOR","float32",[1,3,224,224]],["TENSOR","float32",[64,3,7,7]],["TENSOR","float32",[1,64,1,1]],["TENSOR","float32",[1,64,112,112]]]]]
[5,[[[["GetBlock",[],["pad_temp","main"],["b0"]],["GetBlock",[],["conv2d_nchw","main"],["b1"]],["GetBlock",[],["T_add","main"],["b2"]],["GetBlock",[],["T_relu","main"],["b3"]],["GetBlock",[],["root","main"],["b4"]],["Annotate",["b1","\"SSSRRSRS\""],["meta_schedule.tiling_structure"],[]],["GetLoops",["b1"],[],["l5","l6","l7","l8","l9","l10","l11"]],["SamplePerfectTile",["l5"],[5,64],["v12","v13","v14","v15","v16"]],["Split",["l5","v12","v13","v14","v15","v16"],[1],["l17","l18","l19","l20","l21"]],["SamplePerfectTile",["l6"],[5,64],["v22","v23","v24","v25","v26"]],["Split",["l6","v22","v23","v24","v25","v26"],[1],["l27","l28","l29","l30","l31"]],["SamplePerfectTile",["l7"],[5,64],["v32","v33","v34","v35","v36"]],["Split",["l7","v32","v33","v34","v35","v36"],[1],["l37","l38","l39","l40","l41"]],["SamplePerfectTile",["l8"],[5,64],["v42","v43","v44","v45","v46"]],["Split",["l8","v42","v43","v44","v45","v46"],[1],["l47","l48","l49","l50","l51"]],["SamplePerfectTile",["l9"],[3,64],["v52","v53","v54"]],["Split",["l9","v52","v53","v54"],[1],["l55","l56","l57"]],["SamplePerfectTile",["l10"],[3,64],["v58","v59","v60"]],["Split",["l10","v58","v59","v60"],[1],["l61","l62","l63"]],["SamplePerfectTile",["l11"],[3,64],["v64","v65","v66"]],["Split",["l11","v64","v65","v66"],[1],["l67","l68","l69"]],["Reorder",["l17","l27","l37","l47","l18","l28","l38","l48","l19","l29","l39","l49","l55","l61","l67","l56","l62","l68","l20","l30","l40","l50","l57","l63","l69","l21","l31","l41","l51"],[],[]],["Fuse",["l17","l27","l37","l47"],[1],["l70"]],["Bind",["l70"],["blockIdx.x"],[]],["Fuse",["l18","l28","l38","l48"],[1],["l71"]],["Bind",["l71"],["vthread.x"],[]],["Fuse",["l19","l29","l39","l49"],[1],["l72"]],["Bind",["l72"],["threadIdx.x"],[]],["Annotate",["b1",32],["meta_schedule.thread_extent_low_inclusive"],[]],["Annotate",["b1",1024],["meta_schedule.thread_extent_high_inclusive"],[]],["CacheWrite",["b1",[]],[0,"local"],["b73"]],["ReverseComputeAt",["b73","l72"],[1,-1],[]],["CacheRead",["b1",["b1"]],[0,"shared"],["b74"]],["ComputeAt",["b74","l67"],[1,-1],[]],["GetLoops",["b74"],[],["l75","l76","l77","l78","l79","l80","l81","l82","l83","l84"]],["Fuse",["l81","l82","l83","l84"],[1],["l85"]],["SampleCategorical",[],[[1,2,3,4],[0.25,0.25,0.25,0.25]],["v86"]],["Annotate",["b74","v86"],["meta_schedule.cooperative_fetch"],[]],["CacheRead",["b1",["b1"]],[1,"shared"],["b87"]],["ComputeAt",["b87","l67"],[1,-1],[]],["GetLoops",["b87"],[],["l88","l89","l90","l91","l92","l93","l94","l95","l96","l97"]],["Fuse",["l94","l95","l96","l97"],[1],["l98"]],["SampleCategorical",[],[[1,2,3,4],[0.25,0.25,0.25,0.25]],["v99"]],["Annotate",["b87","v99"],["meta_schedule.cooperative_fetch"],[]],["ReverseComputeInline",["b3"],[],[]],["ReverseComputeInline",["b2"],[],[]],["ComputeInline",["b0"],[],[]],["SampleCategorical",[],[[0,16,64,512,1024],[0.2000000000000000111,0.2000000000000000111,0.2000000000000000111,0.2000000000000000111,0.2000000000000000111]],["v100"]],["Annotate",["b4","v100"],["meta_schedule.unroll_explicit"],[]],["EnterPostproc",[],[],[]],["Unannotate",["b74"],["meta_schedule.cooperative_fetch"],[]],["GetLoops",["b74"],[],["l101","l102","l103","l104","l105","l106","l107"]],["Split",["l107","None",56],[1],["l108","l109"]],["Bind",["l109"],["threadIdx.x"],[]],["Unannotate",["b87"],["meta_schedule.cooperative_fetch"],[]],["GetLoops",["b87"],[],["l110","l111","l112","l113","l114","l115","l116"]],["Split",["l116","None",56],[1],["l117","l118"]],["Bind",["l118"],["threadIdx.x"],[]],["GetBlock",[],["root","main"],["b119"]],["Unannotate",["b119"],["meta_schedule.unroll_explicit"],[]],["GetChildBlocks",["b119"],[],["b120","b121","b122","b123"]],["GetLoops",["b120"],[],["l124","l125","l126","l127","l128","l129","l130","l131"]],["GetLoops",["b121"],[],["l132","l133","l134","l135","l136","l137","l138","l139"]],["GetLoops",["b122"],[],["l140","l141","l142","l143","l144","l145","l146","l147","l148","l149","l150","l151","l152","l153","l154","l155","l156","l157","l158","l159"]],["Annotate",["l140",1024],["pragma_auto_unroll_max_step"],[]],["Annotate",["l140",1],["pragma_unroll_explicit"],[]],["GetLoops",["b123"],[],["l160","l161","l162","l163","l164","l165","l166"]],["GetBlock",[],["conv2d_nchw","main"],["b167"]],["GetLoops",["b167"],[],["l168","l169","l170","l171","l172","l173","l174","l175","l176","l177","l178","l179","l180","l181","l182","l183","l184","l185","l186","l187"]],["DecomposeReduction",["b167","l171"],[],["b188"]]],[[7,[1,1,1,1,1]],[9,[8,2,4,1,1]],[11,[14,1,1,1,8]],[13,[1,2,14,4,1]],[15,[3,1,1]],[17,[7,1,1]],[19,[1,7,1]],[36,0],[42,0],[47,4]]],[9.9481500312304814763e-05],{"arch":"sm_80","keys":["cuda","gpu"],"kind":"cuda","l2_cache_size_bytes":41943040,"max_num_threads":1024,"max_shared_memory_per_block":49152,"max_threads_per_block":1024,"registers_per_block":65536,"tag":"","thread_warp_size":32},[["TENSOR","float32",[1,3,224,224]],["TENSOR","float32",[64,3,7,7]],["TENSOR","float32",[1,64,1,1]],["TENSOR","float32",[1,64,112,112]]]]]
[6,[[[["GetBlock",[],["pad_temp","main"],["b0"]],["GetBlock",[],["pool_max","main"],["b1"]],["GetBlock",[],["T_add","main"],["b2"]],["GetBlock",[],["T_relu","main"],["b3"]],["GetBlock",[],["root","main"],["b4"]],["Unannotate",["b1"],["schedule_rule"],[]],["ReverseComputeInline",["b3"],[],[]],["ComputeInline",["b0"],[],[]],["GetConsumers",["b1"],[],["b5"]],["GetLoops",["b5"],[],["l6","l7","l8","l9"]],["SampleCategorical",[],[[4,8,16,32,64,128,256,512],[0.125,0.125,0.125,0.125,0.125,0.125,0.125,0.125]],["v10"]],["Split",["l9","None","v10"],[1],["l11","l12"]],["Bind",["l12"],["threadIdx.x"],[]],["ComputeAt",["b1","l11"],[1,-1],[]],["SetScope",["b1"],[0,"shared"],[]],["GetLoops",["b1"],[],["l13","l14","l15","l16","l17","l18","l19","l20","l21","l22"]],["Fuse",["l21","l22"],[1],["l23"]],["Split",["l23","None","v10"],[1],["l24","l25"]],["Bind",["l25"],["threadIdx.x"],[]],["SampleCategorical",[],[[0,16,64,512,1024],[0.2000000000000000111,0.2000000000000000111,0.2000000000000000111,0.2000000000000000111,0.2000000000000000111]],["v26"]],["Annotate",["b4","v26"],["meta_schedule.unroll_explicit"],[]],["GetLoops",["b2"],[],["l27","l28","l29","l30","l31"]],["Fuse",["l27","l28","l29","l30"],[1],["l32"]],["Bind",["l32"],["blockIdx.x"],[]],["EnterPostproc",[],[],[]],["GetBlock",[],["root","main"],["b33"]],["Unannotate",["b33"],["meta_schedule.unroll_explicit"],[]],["GetChildBlocks",["b33"],[],["b34","b35"]],["GetLoops",["b34"],[],["l36","l37","l38","l39","l40","l41","l42"]],["Annotate",["l36",16],["pragma_auto_unroll_max_step"],[]],["Annotate",["l36",1],["pragma_unroll_explicit"],[]],["GetLoops",["b35"],[],["l43","l44"]]],[[10,3],[19,1]]],[2.7965635418600336197e-05],{"arch":"sm_80","keys":["cuda","gpu"],"kind":"cuda","l2_cache_size_bytes":41943040,"max_num_threads":1024,"max_shared_memory_per_block":49152,"max_threads_per_block":1024,"registers_per_block":65536,"tag":"","thread_warp_size":32},[["TENSOR","float32",[1,64,112,112]],["TENSOR","float32",[1,64,1,1]],["TENSOR","float32",[1,64,56,56]]]]]
[6,[[[["GetBlock",[],["pad_temp","main"],["b0"]],["GetBlock",[],["pool_max","main"],["b1"]],["GetBlock",[],["T_add","main"],["b2"]],["GetBlock",[],["T_relu","main"],["b3"]],["GetBlock",[],["root","main"],["b4"]],["Unannotate",["b1"],["schedule_rule"],[]],["ReverseComputeInline",["b3"],[],[]],["ComputeInline",["b0"],[],[]],["SampleCategorical",[],[[0,16,64,512,1024],[0.2000000000000000111,0.2000000000000000111,0.2000000000000000111,0.2000000000000000111,0.2000000000000000111]],["v5"]],["Annotate",["b4","v5"],["meta_schedule.unroll_explicit"],[]],["GetLoops",["b2"],[],["l6","l7","l8","l9"]],["Fuse",["l6","l7","l8","l9"],[1],["l10"]],["SampleCategorical",[],[[32,64,128,256,512,1024],[0.16666666666666665741,0.16666666666666665741,0.16666666666666665741,0.16666666666666665741,0.16666666666666665741,0.16666666666666665741]],["v11"]],["Split",["l10","None","v11"],[1],["l12","l13"]],["Bind",["l12"],["blockIdx.x"],[]],["Bind",["l13"],["threadIdx.x"],[]],["GetLoops",["b1"],[],["l14","l15","l16","l17","l18","l19"]],["Fuse",["l14","l15","l16","l17"],[1],["l20"]],["SampleCategorical",[],[[32,64,128,256,512,1024],[0.16666666666666665741,0.16666666666666665741,0.16666666666666665741,0.16666666666666665741,0.16666666666666665741,0.16666666666666665741]],["v21"]],["Split",["l20","None","v21"],[1],["l22","l23"]],["Bind",["l22"],["blockIdx.x"],[]],["Bind",["l23"],["threadIdx.x"],[]],["EnterPostproc",[],[],[]],["GetBlock",[],["root","main"],["b24"]],["Unannotate",["b24"],["meta_schedule.unroll_explicit"],[]],["GetChildBlocks",["b24"],[],["b25","b26"]],["GetLoops",["b25"],[],["l27","l28","l29","l30"]],["Annotate",["l27",16],["pragma_auto_unroll_max_step"],[]],["Annotate",["l27",1],["pragma_unroll_explicit"],[]],["GetLoops",["b26"],[],["l31","l32"]],["GetBlock",[],["pool_max","main"],["b33"]],["GetLoops",["b33"],[],["l34","l35","l36","l37"]],["DecomposeReduction",["b33","l36"],[],["b38"]]],[[8,1],[12,2],[18,3]]],[8.4413280313226480927e-06],{"arch":"sm_80","keys":["cuda","gpu"],"kind":"cuda","l2_cache_size_bytes":41943040,"max_num_threads":1024,"max_shared_memory_per_block":49152,"max_threads_per_block":1024,"registers_per_block":65536,"tag":"","thread_warp_size":32},[["TENSOR","float32",[1,64,112,112]],["TENSOR","float32",[1,64,1,1]],["TENSOR","float32",[1,64,56,56]]]]]
[7,[[[["GetBlock",[],["data_pack","main"],["b0"]],["GetBlock",[],["bgemm","main"],["b1"]],["GetBlock",[],["inverse","main"],["b2"]],["GetBlock",[],["conv2d_winograd","main"],["b3"]],["GetBlock",[],["T_add","main"],["b4"]],["GetBlock",[],["root","main"],["b5"]],["GetProducers",["b2"],[],["b6","b7"]],["ComputeInline",["b7"],[],[]],["GetConsumers",["b2"],[],["b8"]],["GetLoops",["b8"],[],["l9","l10","l11","l12"]],["Split",["l11","None",4],[1],["l13","l14"]],["Split",["l12","None",4],[1],["l15","l16"]],["Reorder",["l13","l15","l14","l16"],[],[]],["ComputeAt",["b2","l15"],[1,-1],[]],["SetScope",["b2"],[0,"local"],[]],["GetLoops",["b2"],[],["l17","l18","l19","l20","l21","l22","l23","l24","l25","l26"]],["Unroll",["l23"],[],[]],["Unroll",["l24"],[],[]],["Unroll",["l25"],[],[]],["Unroll",["l26"],[],[]],["GetProducers",["b0"],[],["b27","b28"]],["ComputeInline",["b28"],[],[]],["GetProducers",["b27"],[],["b29"]],["GetLoops",["b0"],[],["l30","l31","l32","l33","l34","l35"]],["Reorder",["l32","l33","l30","l31","l34","l35"],[],[]],["Unroll",["l30"],[],[]],["Unroll",["l31"],[],[]],["Unroll",["l34"],[],[]],["Unroll",["l35"],[],[]],["Fuse",["l32","l33"],[1],["l36"]],["SampleCategorical",[],[[32,64,128,256,512,1024],[0.16666666666666665741,0.16666666666666665741,0.16666666666666665741,0.16666666666666665741,0.16666666666666665741,0.16666666666666665741]],["v37"]],["Split",["l36","None","v37"],[1],["l38","l39"]],["Bind",["l38"],["blockIdx.x"],[]],["Bind",["l39"],["threadIdx.x"],[]],["CacheWrite",["b0",[]],[0,"local"],["b40"]],["ReverseComputeAt",["b40","l39"],[1,-1],[]],["ComputeAt",["b27","l39"],[1,-1],[]],["SetScope",["b27"],[0,"local"],[]],["ComputeInline",["b29"],[],[]],["Annotate",["b1","\"SSSRRSRS\""],["meta_schedule.tiling_structure"],[]],["GetLoops",["b1"],[],["l41","l42","l43","l44","l45"]],["SamplePerfectTile",["l41"],[5,64],["v46","v47","v48","v49","v50"]],["Split",["l41","v46","v47","v48","v49","v50"],[1],["l51","l52","l53","l54","l55"]],["SamplePerfectTile",["l42"],[5,64],["v56","v57","v58","v59","v60"]],["Split",["l42","v56","v57","v58","v59","v60"],[1],["l61","l62","l63","l64","l65"]],["SamplePerfectTile",["l43"],[5,64],["v66","v67","v68","v69","v70"]],["Split",["l43","v66","v67","v68","v69","v70"],[1],["l71","l72","l73","l74","l75"]],["SamplePerfectTile",["l44"],[5,64],["v76","v77","v78","v79","v80"]],["Split",["l44","v76","v77","v78","v79","v80"],[1],["l81","l82","l83","l84","l85"]],["SamplePerfectTile",["l45"],[3,64],["v86","v87","v88"]],["Split",["l45","v86","v87","v88"],[1],["l89","l90","l91"]],["Reorder",["l51","l61","l71","l81","l52","l62","l72","l82","l53","l63","l73","l83","l89","l90","l54","l64","l74","l84","l91","l55","l65","l75","l85"],[],[]],["Fuse",["l51","l61","l71","l81"],[1],["l92"]],["Bind",["l92"],["blockIdx.x"],[]],["Fuse",["l52","l62","l72","l82"],[1],["l93"]],["Bind",["l93"],["vthread.x"],[]],["Fuse",["l53","l63","l73","l83"],[1],["l94"]],["Bind",["l94"],["threadIdx.x"],[]],["Annotate",["b1",32],["meta_schedule.thread_extent_low_inclusive"],[]],["Annotate",["b1",1024],["meta_schedule.thread_extent_high_inclusive"],[]],["CacheWrite",["b1",[]],[0,"local"],["b95"]],["ReverseComputeAt",["b95","l94"],[1,-1],[]],["CacheRead",["b1",["b1"]],[0,"shared"],["b96"]],["ComputeAt",["b96","l89"],[1,-1],[]],["GetLoops",["b96"],[],["l97","l98","l99","l100","l101","l102","l103","l104"]],["Fuse",["l101","l102","l103","l104"],[1],["l105"]],["SampleCategorical",[],[[1,2,3,4],[0.25,0.25,0.25,0.25]],["v106"]],["Annotate",["b96","v106"],["meta_schedule.cooperative_fetch"],[]],["CacheRead",["b1",["b1"]],[1,"shared"],["b107"]],["ComputeAt",["b107","l89"],[1,-1],[]],["GetLoops",["b107"],[],["l108","l109","l110","l111","l112","l113","l114","l115"]],["Fuse",["l112","l113","l114","l115"],[1],["l116"]],["SampleCategorical",[],[[1,2,3,4],[0.25,0.25,0.25,0.25]],["v117"]],["Annotate",["b107","v117"],["meta_schedule.cooperative_fetch"],[]],["ReverseComputeInline",["b4"],[],[]],["SampleCategorical",[],[[0,16,64,512,1024],[0.2000000000000000111,0.2000000000000000111,0.2000000000000000111,0.2000000000000000111,0.2000000000000000111]],["v118"]],["Annotate",["b5","v118"],["meta_schedule.unroll_explicit"],[]],["GetLoops",["b3"],[],["l119","l120","l121","l122","l123","l124"]],["Fuse",["l119","l120","l121","l122"],[1],["l125"]],["SampleCategorical",[],[[32,64,128,256,512,1024],[0.16666666666666665741,0.16666666666666665741,0.16666666666666665741,0.16666666666666665741,0.16666666666666665741,0.16666666666666665741]],["v126"]],["Split",["l125","None","v126"],[1],["l127","l128"]],["Bind",["l127"],["blockIdx.x"],[]],["Bind",["l128"],["threadIdx.x"],[]],["EnterPostproc",[],[],[]],["Unannotate",["b96"],["meta_schedule.cooperative_fetch"],[]],["GetLoops",["b96"],[],["l129","l130","l131","l132","l133"]],["Split",["l133","None",144],[1],["l134","l135"]],["Bind",["l135"],["threadIdx.x"],[]],["Unannotate",["b107"],["meta_schedule.cooperative_fetch"],[]],["GetLoops",["b107"],[],["l136","l137","l138","l139","l140"]],["Split",["l140","None",144],[1],["l141","l142"]],["Bind",["l142"],["threadIdx.x"],[]],["GetBlock",[],["root","main"],["b143"]],["Unannotate",["b143"],["meta_schedule.unroll_explicit"],[]],["GetChildBlocks",["b143"],[],["b144","b145","b146","b147","b148","b149","b150","b151","b152"]],["GetLoops",["b144"],[],["l153","l154","l155","l156","l157","l158"]],["GetLoops",["b145"],[],["l159","l160","l161","l162","l163","l164"]],["Annotate",["l159",16],["pragma_auto_unroll_max_step"],[]],["Annotate",["l159",1],["pragma_unroll_explicit"],[]],["GetLoops",["b146"],[],["l165","l166","l167","l168","l169","l170"]],["GetLoops",["b147"],[],["l171","l172","l173","l174","l175","l176"]],["GetLoops",["b148"],[],["l177","l178","l179","l180","l181","l182"]],["GetLoops",["b149"],[],["l183","l184","l185","l186","l187","l188","l189","l190","l191","l192","l193","l194","l195","l196"]],["Annotate",["l183",16],["pragma_auto_unroll_max_step"],[]],["Annotate",["l183",1],["pragma_unroll_explicit"],[]],["GetLoops",["b150"],[],["l197","l198","l199","l200","l201","l202","l203"]],["GetLoops",["b151"],[],["l204","l205","l206","l207","l208","l209","l210","l211"]],["Annotate",["l204",16],["pragma_auto_unroll_max_step"],[]],["Annotate",["l204",1],["pragma_unroll_explicit"],[]],["GetLoops",["b152"],[],["l212","l213","l214","l215"]],["GetBlock",[],["data_pack","main"],["b216"]],["GetLoops",["b216"],[],["l217","l218","l219","l220","l221","l222"]],["DecomposeReduction",["b216","l221"],[],["b223"]],["GetBlock",[],["bgemm","main"],["b224"]],["GetLoops",["b224"],[],["l225","l226","l227","l228","l229","l230","l231","l232","l233","l234","l235","l236","l237","l238"]],["DecomposeReduction",["b224","l228"],[],["b239"]],["GetBlock",[],["inverse","main"],["b240"]],["GetLoops",["b240"],[],["l241","l242","l243","l244","l245","l246","l247","l248"]],["DecomposeReduction",["b240","l247"],[],["b249"]]],[[30,0],[41,[1,1,6,1,1]],[43,[1,1,3,1,2]],[45,[1,1,2,16,2]],[47,[1,1,4,7,7]],[49,[64,1,1]],[66,0],[72,0],[75,1],[79,0]]],[0.005032908599999999337],{"arch":"sm_80","keys":["cuda","gpu"],"kind":"cuda","l2_cache_size_bytes":41943040,"max_num_threads":1024,"max_shared_memory_per_block":49152,"max_threads_per_block":1024,"registers_per_block":65536,"tag":"","thread_warp_size":32},[["TENSOR","float32",[1,64,56,56]],["TENSOR","float32",[6,6,64,64]],["TENSOR","float32",[1,64,56,56]],["TENSOR","float32",[1,64,56,56]]]]]
[7,[[[["GetBlock",[],["data_pack","main"],["b0"]],["GetBlock",[],["bgemm","main"],["b1"]],["GetBlock",[],["inverse","main"],["b2"]],["GetBlock",[],["conv2d_winograd","main"],["b3"]],["GetBlock",[],["T_add","main"],["b4"]],["GetBlock",[],["root","main"],["b5"]],["GetProducers",["b2"],[],["b6","b7"]],["ComputeInline",["b7"],[],[]],["GetConsumers",["b2"],[],["b8"]],["GetLoops",["b8"],[],["l9","l10","l11","l12"]],["Split",["l11","None",4],[1],["l13","l14"]],["Split",["l12","None",4],[1],["l15","l16"]],["Reorder",["l13","l15","l14","l16"],[],[]],["ComputeAt",["b2","l15"],[1,-1],[]],["SetScope",["b2"],[0,"local"],[]],["GetLoops",["b2"],[],["l17","l18","l19","l20","l21","l22","l23","l24","l25","l26"]],["Unroll",["l23"],[],[]],["Unroll",["l24"],[],[]],["Unroll",["l25"],[],[]],["Unroll",["l26"],[],[]],["GetProducers",["b0"],[],["b27","b28"]],["ComputeInline",["b28"],[],[]],["GetProducers",["b27"],[],["b29"]],["GetLoops",["b0"],[],["l30","l31","l32","l33","l34","l35"]],["Reorder",["l32","l33","l30","l31","l34","l35"],[],[]],["Unroll",["l30"],[],[]],["Unroll",["l31"],[],[]],["Unroll",["l34"],[],[]],["Unroll",["l35"],[],[]],["Fuse",["l32","l33"],[1],["l36"]],["SampleCategorical",[],[[32,64,128,256,512,1024],[0.16666666666666665741,0.16666666666666665741,0.16666666666666665741,0.16666666666666665741,0.16666666666666665741,0.16666666666666665741]],["v37"]],["Split",["l36","None","v37"],[1],["l38","l39"]],["Bind",["l38"],["blockIdx.x"],[]],["Bind",["l39"],["threadIdx.x"],[]],["CacheWrite",["b0",[]],[0,"local"],["b40"]],["ReverseComputeAt",["b40","l39"],[1,-1],[]],["ComputeAt",["b27","l39"],[1,-1],[]],["SetScope",["b27"],[0,"local"],[]],["ComputeInline",["b29"],[],[]],["Annotate",["b1","\"SSSRRSRS\""],["meta_schedule.tiling_structure"],[]],["GetLoops",["b1"],[],["l41","l42","l43","l44","l45"]],["SamplePerfectTile",["l41"],[5,64],["v46","v47","v48","v49","v50"]],["Split",["l41","v46","v47","v48","v49","v50"],[1],["l51","l52","l53","l54","l55"]],["SamplePerfectTile",["l42"],[5,64],["v56","v57","v58","v59","v60"]],["Split",["l42","v56","v57","v58","v59","v60"],[1],["l61","l62","l63","l64","l65"]],["SamplePerfectTile",["l43"],[5,64],["v66","v67","v68","v69","v70"]],["Split",["l43","v66","v67","v68","v69","v70"],[1],["l71","l72","l73","l74","l75"]],["SamplePerfectTile",["l44"],[5,64],["v76","v77","v78","v79","v80"]],["Split",["l44","v76","v77","v78","v79","v80"],[1],["l81","l82","l83","l84","l85"]],["SamplePerfectTile",["l45"],[3,64],["v86","v87","v88"]],["Split",["l45","v86","v87","v88"],[1],["l89","l90","l91"]],["Reorder",["l51","l61","l71","l81","l52","l62","l72","l82","l53","l63","l73","l83","l89","l90","l54","l64","l74","l84","l91","l55","l65","l75","l85"],[],[]],["Fuse",["l51","l61","l71","l81"],[1],["l92"]],["Bind",["l92"],["blockIdx.x"],[]],["Fuse",["l52","l62","l72","l82"],[1],["l93"]],["Bind",["l93"],["vthread.x"],[]],["Fuse",["l53","l63","l73","l83"],[1],["l94"]],["Bind",["l94"],["threadIdx.x"],[]],["Annotate",["b1",32],["meta_schedule.thread_extent_low_inclusive"],[]],["Annotate",["b1",1024],["meta_schedule.thread_extent_high_inclusive"],[]],["CacheWrite",["b1",[]],[0,"local"],["b95"]],["ReverseComputeAt",["b95","l94"],[1,-1],[]],["CacheRead",["b1",["b1"]],[0,"shared"],["b96"]],["ComputeAt",["b96","l89"],[1,-1],[]],["GetLoops",["b96"],[],["l97","l98","l99","l100","l101","l102","l103","l104"]],["Fuse",["l101","l102","l103","l104"],[1],["l105"]],["SampleCategorical",[],[[1,2,3,4],[0.25,0.25,0.25,0.25]],["v106"]],["Annotate",["b96","v106"],["meta_schedule.cooperative_fetch"],[]],["CacheRead",["b1",["b1"]],[1,"shared"],["b107"]],["ComputeAt",["b107","l89"],[1,-1],[]],["GetLoops",["b107"],[],["l108","l109","l110","l111","l112","l113","l114","l115"]],["Fuse",["l112","l113","l114","l115"],[1],["l116"]],["SampleCategorical",[],[[1,2,3,4],[0.25,0.25,0.25,0.25]],["v117"]],["Annotate",["b107","v117"],["meta_schedule.cooperative_fetch"],[]],["ReverseComputeInline",["b4"],[],[]],["SampleCategorical",[],[[0,16,64,512,1024],[0.2000000000000000111,0.2000000000000000111,0.2000000000000000111,0.2000000000000000111,0.2000000000000000111]],["v118"]],["Annotate",["b5","v118"],["meta_schedule.unroll_explicit"],[]],["GetLoops",["b3"],[],["l119","l120","l121","l122","l123","l124"]],["Fuse",["l119","l120","l121","l122"],[1],["l125"]],["SampleCategorical",[],[[32,64,128,256,512,1024],[0.16666666666666665741,0.16666666666666665741,0.16666666666666665741,0.16666666666666665741,0.16666666666666665741,0.16666666666666665741]],["v126"]],["Split",["l125","None","v126"],[1],["l127","l128"]],["Bind",["l127"],["blockIdx.x"],[]],["Bind",["l128"],["threadIdx.x"],[]],["EnterPostproc",[],[],[]],["Unannotate",["b96"],["meta_schedule.cooperative_fetch"],[]],["GetLoops",["b96"],[],["l129","l130","l131","l132","l133"]],["Split",["l133","None",42,2],[1],["l134","l135","l136"]],["Vectorize",["l136"],[],[]],["Bind",["l135"],["threadIdx.x"],[]],["Unannotate",["b107"],["meta_schedule.cooperative_fetch"],[]],["GetLoops",["b107"],[],["l137","l138","l139","l140","l141"]],["Split",["l141","None",42,4],[1],["l142","l143","l144"]],["Vectorize",["l144"],[],[]],["Bind",["l143"],["threadIdx.x"],[]],["GetBlock",[],["root","main"],["b145"]],["Unannotate",["b145"],["meta_schedule.unroll_explicit"],[]],["GetChildBlocks",["b145"],[],["b146","b147","b148","b149","b150","b151","b152","b153","b154"]],["GetLoops",["b146"],[],["l155","l156","l157","l158","l159","l160"]],["GetLoops",["b147"],[],["l161","l162","l163","l164","l165","l166"]],["GetLoops",["b148"],[],["l167","l168","l169","l170","l171","l172"]],["GetLoops",["b149"],[],["l173","l174","l175","l176","l177","l178","l179"]],["GetLoops",["b150"],[],["l180","l181","l182","l183","l184","l185","l186"]],["GetLoops",["b151"],[],["l187","l188","l189","l190","l191","l192","l193","l194","l195","l196","l197","l198","l199","l200"]],["GetLoops",["b152"],[],["l201","l202","l203","l204","l205","l206","l207"]],["GetLoops",["b153"],[],["l208","l209","l210","l211","l212","l213","l214","l215"]],["GetLoops",["b154"],[],["l216","l217","l218","l219"]],["GetBlock",[],["data_pack","main"],["b220"]],["GetLoops",["b220"],[],["l221","l222","l223","l224","l225","l226"]],["DecomposeReduction",["b220","l225"],[],["b227"]],["GetBlock",[],["bgemm","main"],["b228"]],["GetLoops",["b228"],[],["l229","l230","l231","l232","l233","l234","l235","l236","l237","l238","l239","l240","l241","l242"]],["DecomposeReduction",["b228","l232"],[],["b243"]],["GetBlock",[],["inverse","main"],["b244"]],["GetLoops",["b244"],[],["l245","l246","l247","l248","l249","l250","l251","l252"]],["DecomposeReduction",["b244","l251"],[],["b253"]]],[[30,5],[41,[2,1,1,3,1]],[43,[1,1,6,1,1]],[45,[2,4,1,8,1]],[47,[7,1,7,1,4]],[49,[32,1,2]],[66,1],[72,3],[75,0],[79,0]]],[0.00024395276641221374744],{"arch":"sm_80","keys":["cuda","gpu"],"kind":"cuda","l2_cache_size_bytes":41943040,"max_num_threads":1024,"max_shared_memory_per_block":49152,"max_threads_per_block":1024,"registers_per_block":65536,"tag":"","thread_warp_size":32},[["TENSOR","float32",[1,64,56,56]],["TENSOR","float32",[6,6,64,64]],["TENSOR","float32",[1,64,56,56]],["TENSOR","float32",[1,64,56,56]]]]]
[8,[[[["GetBlock",[],["T_add","main"],["b0"]],["GetBlock",[],["T_relu","main"],["b1"]],["ReverseComputeInline",["b1"],[],[]],["GetLoops",["b0"],[],["l2","l3","l4","l5"]],["Fuse",["l2","l3","l4","l5"],[1],["l6"]],["SampleCategorical",[],[[32,64,128,256,512,1024],[0.16666666666666665741,0.16666666666666665741,0.16666666666666665741,0.16666666666666665741,0.16666666666666665741,0.16666666666666665741]],["v7"]],["Split",["l6","None","v7"],[1],["l8","l9"]],["Bind",["l8"],["blockIdx.x"],[]],["Bind",["l9"],["threadIdx.x"],[]],["EnterPostproc",[],[],[]]],[[5,3]]],[3.3923483103404630104e-06],{"arch":"sm_80","keys":["cuda","gpu"],"kind":"cuda","l2_cache_size_bytes":41943040,"max_num_threads":1024,"max_shared_memory_per_block":49152,"max_threads_per_block":1024,"registers_per_block":65536,"tag":"","thread_warp_size":32},[["TENSOR","float32",[1,64,56,56]],["TENSOR","float32",[1,64,1,1]],["TENSOR","float32",[1,64,56,56]]]]]
[8,[[[["GetBlock",[],["T_add","main"],["b0"]],["GetBlock",[],["T_relu","main"],["b1"]],["ReverseComputeInline",["b1"],[],[]],["GetLoops",["b0"],[],["l2","l3","l4","l5"]],["Fuse",["l2","l3","l4","l5"],[1],["l6"]],["SampleCategorical",[],[[32,64,128,256,512,1024],[0.16666666666666665741,0.16666666666666665741,0.16666666666666665741,0.16666666666666665741,0.16666666666666665741,0.16666666666666665741]],["v7"]],["Split",["l6","None","v7"],[1],["l8","l9"]],["Bind",["l8"],["blockIdx.x"],[]],["Bind",["l9"],["threadIdx.x"],[]],["EnterPostproc",[],[],[]]],[[5,0]]],[7.5973579772939176977e-06],{"arch":"sm_80","keys":["cuda","gpu"],"kind":"cuda","l2_cache_size_bytes":41943040,"max_num_threads":1024,"max_shared_memory_per_block":49152,"max_threads_per_block":1024,"registers_per_block":65536,"tag":"","thread_warp_size":32},[["TENSOR","float32",[1,64,56,56]],["TENSOR","float32",[1,64,1,1]],["TENSOR","float32",[1,64,56,56]]]]]
[9,[[[["GetBlock",[],["data_pack","main"],["b0"]],["GetBlock",[],["bgemm","main"],["b1"]],["GetBlock",[],["inverse","main"],["b2"]],["GetBlock",[],["conv2d_winograd","main"],["b3"]],["GetBlock",[],["T_add","main"],["b4"]],["GetBlock",[],["T_relu","main"],["b5"]],["GetBlock",[],["root","main"],["b6"]],["GetProducers",["b2"],[],["b7","b8"]],["ComputeInline",["b8"],[],[]],["GetConsumers",["b2"],[],["b9"]],["GetLoops",["b9"],[],["l10","l11","l12","l13"]],["Split",["l12","None",4],[1],["l14","l15"]],["Split",["l13","None",4],[1],["l16","l17"]],["Reorder",["l14","l16","l15","l17"],[],[]],["ComputeAt",["b2","l16"],[1,-1],[]],["SetScope",["b2"],[0,"local"],[]],["GetLoops",["b2"],[],["l18","l19","l20","l21","l22","l23","l24","l25","l26","l27"]],["Unroll",["l24"],[],[]],["Unroll",["l25"],[],[]],["Unroll",["l26"],[],[]],["Unroll",["l27"],[],[]],["GetProducers",["b0"],[],["b28","b29"]],["ComputeInline",["b29"],[],[]],["GetProducers",["b28"],[],["b30"]],["GetLoops",["b0"],[],["l31","l32","l33","l34","l35","l36"]],["Reorder",["l33","l34","l31","l32","l35","l36"],[],[]],["Unroll",["l31"],[],[]],["Unroll",["l32"],[],[]],["Unroll",["l35"],[],[]],["Unroll",["l36"],[],[]],["Fuse",["l33","l34"],[1],["l37"]],["SampleCategorical",[],[[32,64,128,256,512,1024],[0.16666666666666665741,0.16666666666666665741,0.16666666666666665741,0.16666666666666665741,0.16666666666666665741,0.16666666666666665741]],["v38"]],["Split",["l37","None","v38"],[1],["l39","l40"]],["Bind",["l39"],["blockIdx.x"],[]],["Bind",["l40"],["threadIdx.x"],[]],["CacheWrite",["b0",[]],[0,"local"],["b41"]],["ReverseComputeAt",["b41","l40"],[1,-1],[]],["ComputeAt",["b28","l40"],[1,-1],[]],["SetScope",["b28"],[0,"local"],[]],["ComputeInline",["b30"],[],[]],["Annotate",["b1","\"SSSRRSRS\""],["meta_schedule.tiling_structure"],[]],["GetLoops",["b1"],[],["l42","l43","l44","l45","l46"]],["SamplePerfectTile",["l42"],[5,64],["v47","v48","v49","v50","v51"]],["Split",["l42","v47","v48","v49","v50","v51"],[1],["l52","l53","l54","l55","l56"]],["SamplePerfectTile",["l43"],[5,64],["v57","v58","v59","v60","v61"]],["Split",["l43","v57","v58","v59","v60","v61"],[1],["l62","l63","l64","l65","l66"]],["SamplePerfectTile",["l44"],[5,64],["v67","v68","v69","v70","v71"]],["Split",["l44","v67","v68","v69","v70","v71"],[1],["l72","l73","l74","l75","l76"]],["SamplePerfectTile",["l45"],[5,64],["v77","v78","v79","v80","v81"]],["Split",["l45","v77","v78","v79","v80","v81"],[1],["l82","l83","l84","l85","l86"]],["SamplePerfectTile",["l46"],[3,64],["v87","v88","v89"]],["Split",["l46","v87","v88","v89"],[1],["l90","l91","l92"]],["Reorder",["l52","l62","l72","l82","l53","l63","l73","l83","l54","l64","l74","l84","l90","l91","l55","l65","l75","l85","l92","l56","l66","l76","l86"],[],[]],["Fuse",["l52","l62","l72","l82"],[1],["l93"]],["Bind",["l93"],["blockIdx.x"],[]],["Fuse",["l53","l63","l73","l83"],[1],["l94"]],["Bind",["l94"],["vthread.x"],[]],["Fuse",["l54","l64","l74","l84"],[1],["l95"]],["Bind",["l95"],["threadIdx.x"],[]],["Annotate",["b1",32],["meta_schedule.thread_extent_low_inclusive"],[]],["Annotate",["b1",1024],["meta_schedule.thread_extent_high_inclusive"],[]],["CacheWrite",["b1",[]],[0,"local"],["b96"]],["ReverseComputeAt",["b96","l95"],[1,-1],[]],["CacheRead",["b1",["b1"]],[0,"shared"],["b97"]],["ComputeAt",["b97","l90"],[1,-1],[]],["GetLoops",["b97"],[],["l98","l99","l100","l101","l102","l103","l104","l105"]],["Fuse",["l102","l103","l104","l105"],[1],["l106"]],["SampleCategorical",[],[[1,2,3,4],[0.25,0.25,0.25,0.25]],["v107"]],["Annotate",["b97","v107"],["meta_schedule.cooperative_fetch"],[]],["CacheRead",["b1",["b1"]],[1,"shared"],["b108"]],["ComputeAt",["b108","l90"],[1,-1],[]],["GetLoops",["b108"],[],["l109","l110","l111","l112","l113","l114","l115","l116"]],["Fuse",["l113","l114","l115","l116"],[1],["l117"]],["SampleCategorical",[],[[1,2,3,4],[0.25,0.25,0.25,0.25]],["v118"]],["Annotate",["b108","v118"],["meta_schedule.cooperative_fetch"],[]],["Fuse",["l90"],[1],["l119"]],["Annotate",["l119",[0,0,3]],["software_pipeline_stage"],[]],["Annotate",["l119",[0,1,2]],["software_pipeline_order"],[]],["Annotate",["l119",[0]],["software_pipeline_async_stages"],[]],["ReverseComputeInline",["b5"],[],[]],["ReverseComputeInline",["b4"],[],[]],["SampleCategorical",[],[[0,16,64,512,1024],[0.2000000000000000111,0.2000000000000000111,0.2000000000000000111,0.2000000000000000111,0.2000000000000000111]],["v120"]],["Annotate",["b6","v120"],["meta_schedule.unroll_explicit"],[]],["GetLoops",["b3"],[],["l121","l122","l123","l124","l125","l126"]],["Fuse",["l121","l122","l123","l124"],[1],["l127"]],["SampleCategorical",[],[[32,64,128,256,512,1024],[0.16666666666666665741,0.16666666666666665741,0.16666666666666665741,0.16666666666666665741,0.16666666666666665741,0.16666666666666665741]],["v128"]],["Split",["l127","None","v128"],[1],["l129","l130"]],["Bind",["l129"],["blockIdx.x"],[]],["Bind",["l130"],["threadIdx.x"],[]],["EnterPostproc",[],[],[]],["Unannotate",["b97"],["meta_schedule.cooperative_fetch"],[]],["GetLoops",["b97"],[],["l131","l132","l133","l134","l135"]],["Split",["l135","None",112,3],[1],["l136","l137","l138"]],["Vectorize",["l138"],[],[]],["Bind",["l137"],["threadIdx.x"],[]],["Unannotate",["b108"],["meta_schedule.cooperative_fetch"],[]],["GetLoops",["b108"],[],["l139","l140","l141","l142","l143"]],["Split",["l143","None",112,2],[1],["l144","l145","l146"]],["Vectorize",["l146"],[],[]],["Bind",["l145"],["threadIdx.x"],[]],["GetBlock",[],["root","main"],["b147"]],["Unannotate",["b147"],["meta_schedule.unroll_explicit"],[]],["GetChildBlocks",["b147"],[],["b148","b149","b150","b151","b152","b153","b154","b155","b156"]],["GetLoops",["b148"],[],["l157","l158","l159","l160","l161","l162"]],["GetLoops",["b149"],[],["l163","l164","l165","l166","l167","l168"]],["Annotate",["l163",1024],["pragma_auto_unroll_max_step"],[]],["Annotate",["l163",1],["pragma_unroll_explicit"],[]],["GetLoops",["b150"],[],["l169","l170","l171","l172","l173","l174"]],["GetLoops",["b151"],[],["l175","l176","l177","l178","l179","l180","l181"]],["GetLoops",["b152"],[],["l182","l183","l184","l185","l186","l187","l188"]],["GetLoops",["b153"],[],["l189","l190","l191","l192","l193","l194","l195","l196","l197","l198","l199","l200","l201","l202"]],["Annotate",["l189",1024],["pragma_auto_unroll_max_step"],[]],["Annotate",["l189",1],["pragma_unroll_explicit"],[]],["GetLoops",["b154"],[],["l203","l204","l205","l206","l207","l208","l209"]],["GetLoops",["b155"],[],["l210","l211","l212","l213","l214","l215","l216","l217"]],["Annotate",["l210",1024],["pragma_auto_unroll_max_step"],[]],["Annotate",["l210",1],["pragma_unroll_explicit"],[]],["GetLoops",["b156"],[],["l218","l219","l220","l221"]],["GetBlock",[],["data_pack","main"],["b222"]],["GetLoops",["b222"],[],["l223","l224","l225","l226","l227","l228"]],["DecomposeReduction",["b222","l227"],[],["b229"]],["GetBlock",[],["bgemm","main"],["b230"]],["GetLoops",["b230"],[],["l231","l232","l233","l234","l235","l236","l237","l238","l239","l240","l241","l242","l243","l244"]],["DecomposeReduction",["b230","l234"],[],["b245"]],["GetBlock",[],["inverse","main"],["b246"]],["GetLoops",["b246"],[],["l247","l248","l249","l250","l251","l252","l253","l254"]],["DecomposeReduction",["b246","l253"],[],["b255"]]],[[31,1],[42,[3,1,1,2,1]],[44,[1,1,2,3,1]],[46,[2,2,8,2,1]],[48,[1,7,7,2,2]],[50,[64,1,1]],[67,2],[73,1],[81,4],[85,2]]],[0.00085479074074074079276],{"arch":"sm_80","keys":["cuda","gpu"],"kind":"cuda","l2_cache_size_bytes":41943040,"max_num_threads":1024,"max_shared_memory_per_block":49152,"max_threads_per_block":1024,"registers_per_block":65536,"tag":"","thread_warp_size":32},[["TENSOR","float32",[1,64,56,56]],["TENSOR","float32",[6,6,64,64]],["TENSOR","float32",[1,64,1,1]],["TENSOR","float32",[1,64,56,56]]]]]
